{
  "schema_version": "1.0",
  "status": "blank_template_not_a_completed_lock",
  "partition": null,
  "rater_count": 0,
  "rater_A_id": null,
  "rater_B_id": null,
  "raters_distinct": null,
  "rater_A_independence_confirmed": null,
  "rater_B_independence_confirmed": null,
  "rubric_sha256": null,
  "packet_manifest_sha256": null,
  "rater_A_response_sha256": null,
  "rater_B_response_sha256": null,
  "rater_A_declaration_sha256": null,
  "rater_B_declaration_sha256": null,
  "response_schema_validation_passed": null,
  "pre_adjudication_agreement_recorded": null,
  "independent_annotation_ready": false,
  "locked_at": null,
  "custodian": null,
  "unblinded_at": null,
  "notes": "Do not set status=locked until two real response files exist and hashes are verified."
}
